{
  "submission_id": "fixture_human_submission_a",
  "coder_id": "human_coder_a",
  "coder_role": "human_coder",
  "submission_date": "2026-08-12",
  "input_packet_id": "stage4h_dac4a065fdfff159",
  "input_packet_hash": "2e413a38d5588500d636bfd1fbec694ee0f7f0c9b56fdba1778bc3313d22ed2d",
  "training_completed": true,
  "conflict_disclosure": "none",
  "notes": "Valid Stage 4H JSON fixture for primary human coder A.",
  "items": [
    {
      "packet_unit_id": "stage4h_ident_00001",
      "task_type": "sentence_identification",
      "doc_id": "doc_001",
      "sentence_id": "doc_001_s01_p01_s01",
      "span_id": null,
      "metaphor_present": "no",
      "lexical_unit": null,
      "lexical_unit_start": null,
      "lexical_unit_end": null,
      "basic_meaning": null,
      "contextual_meaning": null,
      "semantic_contrast": "no",
      "source_domain": null,
      "target_domain": null,
      "cluster_id": null,
      "mapping_description": null,
      "koenigsberg_function": null,
      "violence_logic": null,
      "obligatory_frame": null,
      "sacrifice_logic": null,
      "guilt_logic": null,
      "providence_logic": null,
      "reconciliation_logic": null,
      "primary_actor": null,
      "acted_upon_entity": null,
      "agency_status": "none",
      "absence_flag": null,
      "enslaved_people_present": "no",
      "black_soldiers_present": "no",
      "disease_or_purification_present": "no",
      "confidence": "medium",
      "ambiguity_flag": "no",
      "rival_reading": null,
      "out_of_scope": "no",
      "coder_comment": "Fixture negative identification item."
    },
    {
      "packet_unit_id": "stage4h_field_00001",
      "task_type": "field_agreement",
      "doc_id": "doc_001",
      "sentence_id": "doc_001_s01_p02_s03",
      "span_id": "stage4h_field_00001",
      "metaphor_present": "yes",
      "lexical_unit": "the legal inheritors of these fundamental blessings",
      "lexical_unit_start": 58,
      "lexical_unit_end": 109,
      "basic_meaning": "People who legally receive property or obligations from predecessors.",
      "contextual_meaning": "The present generation receives political institutions as an inherited civic trust.",
      "semantic_contrast": "yes",
      "source_domain": "inheritance",
      "target_domain": "political_institutions",
      "cluster_id": "cluster_05_fathers_inheritance",
      "mapping_description": "Civic institutions are construed as inherited property from ancestors.",
      "koenigsberg_function": "ancestral_debt",
      "violence_logic": null,
      "obligatory_frame": "The inheritance imposes a duty of preservation.",
      "sacrifice_logic": null,
      "guilt_logic": null,
      "providence_logic": null,
      "reconciliation_logic": null,
      "primary_actor": "we",
      "acted_upon_entity": "political institutions",
      "agency_status": "active",
      "absence_flag": null,
      "enslaved_people_present": "no",
      "black_soldiers_present": "no",
      "disease_or_purification_present": "no",
      "confidence": "high",
      "ambiguity_flag": "no",
      "rival_reading": null,
      "out_of_scope": "no",
      "coder_comment": "Fixture positive field-agreement item."
    }
  ]
}
